{"$schema":"https://json-schema.org/draft/2020-12/schema","$id":"https://lnhgames.dev/lnh-prism/schemas/ornament-anchor/1.0","type":"object","additionalProperties":false,"required":["schemaVersion","id","version","status","bindings","compatibility"],"properties":{"schemaVersion":{"const":"1.0"},"id":{"type":"string","pattern":"^[a-z][a-z0-9-]{2,62}$"},"version":{"type":"string"},"status":{"enum":["draft","reviewed","approved","deprecated"]},"bindings":{"type":"array","minItems":1,"items":{"type":"object","additionalProperties":false,"required":["id","componentId","anchor","ornamentId","clip"],"properties":{"id":{"type":"string","pattern":"^[a-z][a-z0-9-]{2,62}$"},"componentId":{"enum":["primary-hex-button","secondary-hex-button","panel","tab","badge","progress","icon-container"]},"anchor":{"enum":["top-left","top-right","bottom-left","bottom-right","center"]},"ornamentId":{"type":"string","pattern":"^[a-z][a-z0-9-]{2,62}$"},"clip":{"type":"boolean"},"mirrorOf":{"type":"string"}}}},"compatibility":{"type":"object","additionalProperties":false,"required":["minimumRendererVersion"],"properties":{"minimumRendererVersion":{"type":"string"}}}}}
