{"schemaVersion":"1.0","id":"m9-frostbound-ornament-anchors","version":"1.0.0","status":"approved","bindings":[{"id":"m9-panel-corner-left","componentId":"panel","anchor":"top-left","ornamentId":"m9-ice-corner","clip":true},{"id":"m9-panel-corner-right","componentId":"panel","anchor":"top-right","ornamentId":"m9-ice-corner","clip":true,"mirrorOf":"m9-panel-corner-left"},{"id":"m9-button-corner-left","componentId":"primary-hex-button","anchor":"bottom-left","ornamentId":"m9-ice-corner","clip":true},{"id":"m9-button-corner-right","componentId":"primary-hex-button","anchor":"bottom-right","ornamentId":"m9-ice-corner","clip":true,"mirrorOf":"m9-button-corner-left"}],"compatibility":{"minimumRendererVersion":"0.1.0"}}
