{"schemaVersion":"1.0","id":"m11-enchanted-forest-ornament-anchors","version":"0.1.0","status":"approved","bindings":[{"id":"m11-panel-vine-left","componentId":"panel","anchor":"top-left","ornamentId":"m11-leaf-vine","clip":true},{"id":"m11-panel-vine-right","componentId":"panel","anchor":"top-right","ornamentId":"m11-leaf-vine","clip":true,"mirrorOf":"m11-panel-vine-left"},{"id":"m11-primary-leaf-left","componentId":"primary-hex-button","anchor":"bottom-left","ornamentId":"m11-leaf-mark","clip":true},{"id":"m11-primary-leaf-right","componentId":"primary-hex-button","anchor":"bottom-right","ornamentId":"m11-leaf-mark","clip":true,"mirrorOf":"m11-primary-leaf-left"}],"compatibility":{"minimumRendererVersion":"0.1.0"}}
