{"schemaVersion":"1.0","id":"m10-volcanic-forge-ornament-anchors","version":"0.1.0","status":"approved","bindings":[{"id":"m10-panel-rune-left","componentId":"panel","anchor":"top-left","ornamentId":"m10-forged-rune","clip":true},{"id":"m10-panel-rune-right","componentId":"panel","anchor":"top-right","ornamentId":"m10-forged-rune","clip":true,"mirrorOf":"m10-panel-rune-left"},{"id":"m10-primary-rivet-left","componentId":"primary-hex-button","anchor":"bottom-left","ornamentId":"m10-brass-rivet","clip":true},{"id":"m10-primary-rivet-right","componentId":"primary-hex-button","anchor":"bottom-right","ornamentId":"m10-brass-rivet","clip":true,"mirrorOf":"m10-primary-rivet-left"}],"compatibility":{"minimumRendererVersion":"0.1.0"}}
